Text,Toxicity
I needed to see the way your mother came  and was embarrassing I'm sorry I'm sorry,0.07187806186266243
you want me to answer a name that  is not what I can only answer,1.8610626459121704
okay what is wrong with you have I not told you  that I do not have feelings for you hey I don't  ,0.5240463186055422
want you but I love you I truly love you if I like  this life New Balance at all how person will take  ,7.93340876698494
the look for a go to get F9 okay what only buy  that now what do you mean isn't all of yours I  ,0.7722415961325169
don't like you I don't like you what language you  want me to tell you that you understand should I   say it in Igbo or hausa or Yoruba listen  I understand you don't like me but I wait  ,0.1370829646475613
I will wait because I love you we will  wait until you die you wait until you die  ,0.6874242331832647
you go and look for your class go and look for  someone that will date you for me I am taking,0.23279914166778326
by who I can of course who else,7.535235583782196
clean this place see let me tell you okay don't  even have a single feelings for you I'm telling  ,0.2901204163208604
you he personally told me that so please give  me the chance just give me the chance so that  ,8.749037981033325
I can show you how much I truly love you I can  take good care of you you you take a good look  ,3.0791429802775383
at this show but I can take good care of it  hey Ken doesn't love me let me be the one to  ,0.9414521977305412
judge that okay if Ken doesn't love me how  is that your business eh tell me how is your   business nonsense next time stop me stop me on  the road again to tell me about this Stupid Love,0.03546707739587873
don't worry I keep telling you I'm a  very important person in this community,8.804578334093094
don't worry I will show you,3.9896056056022644
but,5.84585964679718
hi Hi how are you oh what's not  your name again my name is peace oh,4.939008876681328
peace you are so beautiful are you heading my  way anyways uh thank you for the compliment  ,7.791327685117722
but I'm going to the market my mother  sent me to go and deliver a message that is my way too yeah yeah yes yes,1.6971638426184654
especially when the Love is  Real it's a very special thing,8.346979320049286
and I love you so many times because you  know my love is always bigger than yours,5.716981366276741
baby,1.1866738088428974
uh you see I'm so sorry for for everything  I'm sorry for for not checking on you,6.949107348918915
by nonchalant attitude   you know it's just it's just right okay  you know a man's Pride that's just it,1.330866850912571
is,5.410399287939072
strength,7.761997729539871
but I'm motivated yes I know it it sounded  so awkwardly and all that but I was indeed  ,9.582825005054474
motivated and I want to let you know  something once this money comes okay,7.528387755155563
I love you so much okay,8.243665844202042
I cannot can barely concentrate,2.272622473537922
is making me get worried I don't  know what to do up till now Beauty,0.8134202100336552
what am I going to do even me I'm worried because I know if Papa  comes back now don't be trouble it is a career  ,1.2082524597644806
problem he just finished ranting  shaking the openness swearing and  ,0.9683107025921345
all that and stop out I don't know what  is going to happen when it comes back  ,1.3814395293593407
does your sister want to kill me does he want  to cause problems between me and your father,0.3268018364906311
how will I don't understand you don't  understand you know how your father is  ,0.11373934103175998
you know how mean he can be I don't even know how  to face him I don't know if he goes and come back  ,0.48142909072339535
and find out that beauty is not back up there  now I don't know what he's going to do to me   I don't know what to do now I  don't even want his trouble at all,1.0127237066626549
now you have to calm down it's not your fault  after all you didn't take Beauty out yourself  ,0.3026712452992797
please mama what our advice you go inside  and rest in fact pretend like you are sick  ,0.04389688838273287
so whenever because we allow you ready yes  now you have to pretend they are sick are  ,0.09385914891026914
you sure that would work yes that's  the only solution go inside lie down,0.4445284605026245
as if you're always Junior  was completed on the way  ,2.1056784316897392
yes now because I don't just have  time for that months for Allah,0.6608070805668831
like dance in that case you have to come come  with me now stand at the door so  ,0.5879495292901993
that you let me know when he when he's  coming my my heart is beating faster  ,3.3286113291978836
now I'm I'm really really scared  mama going like that don't worry,0.60278563760221
massage,0.7951898500323296
thank God don't think again,5.431355535984039
you're scared you don't need to be scared,0.2275407314300537
I'm not scared because you know how my  father can be I'm scared to my mother,0.25479854084551334
I'm not sure what happened to her all right,4.866450652480125
love me so much anything and you know how he is  by now you'll be saying she made me disobey him,0.9220344945788383
okay we love us your father your mother  means for each of those questions cookies,0.9412494488060474
please,8.127769827842712
looking from this Village is not a good idea  yes you just said now that you're scared because  ,2.1310776472091675
of what your father now imagine when you look  from this place by the time we are coming back  ,1.1477411724627018
can also before your mother you know so  what about your mother how will she survive,0.08880699169822037
all right the thing is that I love you so  much and I can go through anything because,7.073643058538437
you know what too much,2.9991459101438522
please I'm begging you peace what is the  place for am I hearing you well yes sir,8.278309553861618
please get my daughter back here in Egypt that's  all I want um he will come back I'm I'm sure by  ,1.238375436514616
your magic buy your magic wherever you have hidden  Beauty go and bring her out there and foreign,0.8771225810050964
to swear to take oath if you know  what you're telling me is the truth  ,1.1306311003863811
let me give it to you no problem I'll swear,0.5621110554784536
put in your mouth if you know what  you're telling me is the truth put  ,0.04016515449620783
this in your mind there's no need there's  no need please I see you huh as long as,1.7727011814713478
my daughter must be brought back whether you  like it see I may have to use you to replace  ,0.8593912236392498
her hey I may have to use you to replace  my daughter I cherish her okay because,1.2335645034909248
please,8.127769827842712
if my daughter does not mean  anything to you she means to me  ,3.765593096613884
oh yeah at least I'm sure of getting a good a good  a good diary out of her head and a good husband  ,0.5211892537772655
and a good house probably a mansion you're telling  that you're telling me I'm going out one two three,2.6119686663150787
no because you know because  you know because because,1.3786505907773972
please,8.127769827842712
hi um,6.515959650278091
I'm worried I'm worried about your father  you know he likes trouble I'm not what he's  ,0.20633535459637642
going to do there huh hi Beauty come back you  didn't come back and vindicate back come back,0.2718054922297597
telling some of the youths that  can kidnap his daughter yes I'm  ,4.100486263632774
not the villagers are following  him to King's house to arrest him   Ken is in trouble all we need to do now is to  save Ken and beauty okay forget about that idiot  ,0.04118261858820915
jaw yeah she's not important now wait she's not  an age of wait I even thought by now she should  ,0.4133544396609068
have married oh really forget about that as  you can see I'm going straight to Ken's house  ,2.5422878563404083
to tell the mother the situation at hand if  you're going coming with me you better start,0.34470842219889164
there is problem we have to live here now  in first we need to live here right now,0.7139756809920073
your father the news what yes please let's just leave here,0.9218235500156879
he said that if he doesn't see you  today that he will send the police  ,1.102595217525959
to arrest my mother I don't want  anything to happen to my mother you   know who my mother is now and she's sick  please let's go let's leave this place,0.2512594684958458
calm down,5.309709906578064
oh okay do one thing for me just just stay in hiding  I will go there when everything is listen now  ,3.2683707773685455
listen you've been talking that is not even my  problem if you go now and see your father it's   not any problem right now okay your father  has even paid some youth he told them that  ,0.21218315232545137
they should look for you anywhere they see  you they should bring you to him and that is   putting me in in the dark so what I'm saying  is let's just go and meet your father and  ,0.7275822106748819
let's solve all these things because you're  going to meet him it was the service a problem,6.525985151529312
do something what is it,2.2855592891573906
what are you talking about sir I can tell you that  I swear the Muslims decision I should make love   to you listen there is for everything forget  about love make it now let us know how we can  ,0.6742196157574654
salvage this situation please please there is  something more important I I want to tell you  ,8.984869718551636
you know the money I told you I was saving  for your your breakfast it's complete,0.6248782388865948
nothing,1.0374571196734905
please die I think you're taking this whole  thing too far it's not necessary listen if  ,0.46692746691405773
I don't see beauty I arrested for my if  I don't see beauty I arrest you foreign,0.2789065707474947
right yeah it's not fair at all how can I even  deprive in our daughter of her happiness if you  ,3.148236870765686
don't know what to say just shut up your mouth  but get out from there get out from here your  ,0.05114615196362138
your infuriating me get out from actually I'm not  looking at anybody's face now get out nonsense  ,0.03482318134047091
nine nine Informer is a widow ifeoma is a widow,1.6420887783169746
no one put us under because  the love is real Beauty,4.431008547544479
um against mother yes you can  run to the house and save his what please,0.46420893631875515
don't have anybody to speak  for you and your son help hey,3.3820874989032745
you will not kill me or I don't know  what I did to you you would not kill me,0.5078882910311222
so many Temptations,0.7589246612042189
because that's your iniquity,0.1406997675076127
look at them just look at them yeah move,5.368921533226967
what is right and what is wrong,5.567510426044464
have you ever when did you take over  police force from from police when did  ,3.74571792781353
you take away the the the work  of the law enforcement against   each other I am the one you're  looking for and I'm here now is,4.654793068766594
My Father Here was always chasing me again  all the time so I followed him willingly he  ,7.05176517367363
never kidnapped me so please again will  come out of hiding but Papa promised me  ,3.086962178349495
he will not do anything to him nobody  will touch Ken or Ken's mother nobody  ,0.39030457846820354
can possible that one will  be resolved little little,9.312895685434341
resolution comes later not right now we're not  here to please you we are here to please the  ,6.342315673828125
Lord let me tell you all these things you're  doing is in vain because it's sickened I will  ,0.2540213521569967
marry Ken whether you like it or not I have  respected you enough us alone what is this,5.26379831135273
let them be happy,6.371078640222549
hey beauty where are you doing parents now I'm  your mother I'm the one that gave birth to you and  ,0.10094445897266269
my husband is your father you say because of your  father's Behavior that's where he has always been  ,0.21458680275827646
um tell me the truth who are my real  parents because I remember everything  ,5.691281333565712
what is it what are you trying to do you will  try to molest that girl is it because she's  ,0.05116676911711693
not a biological daughter shut up your mouth  you're not the one that tell me what to do  ,0.029774519498459995
the girl in question is my investment don't put  your mouth there again and so and so can't you  ,0.04422143683768809
take out like your child can't you take her  this is not fair it's an abomination hey hey,0.03356568922754377
when it comes back asking um foreign,6.29349946975708
that's what [ __ ] you okay just give us,7.7006034553050995
what,6.129459664225578
what is going on a lot like words,7.403904944658279
hmm,2.6122549548745155
ons,3.1085001304745674
please don't take it close to your body,0.5262061487883329
kill yourself I'm not here to receive anything from you option  he said that you give me back my money now  ,0.48189572989940643
or you give me your daughter that's  the only option I'm asking for   don't don't touch me don't touch me call  this money to you yeah I'll report this  ,0.21347966976463795
morning give me that which money money for the  past three months when you were when your wife   was giving back I told you before you even  before you wanted to go do you have money you  ,0.16579633811488748
said you will manage you will go I won't have  to go and pregnant again I don't have money,0.6198705639690161
more than three months okay if I ask you to  give me the money start giving me a story  ,7.273422181606293
that option is he said that you give me the  money now or I take your only daughter how long,0.24489541538059711
three months what kind of research is that  are you insulting me so you do not I'm not  ,0.22018873132765293
a bank that I'll be saving money for you  whenever you have an issue you run to me   to come and give you the money that you  cannot refund back I don't have I'm not  ,1.6346463933587074
saying that we are not friends so just  give me your daughter let me keep it when   you give me my money yeah I refund back your  daughter to you simple it's just about my life,0.1509739551693201
okay,6.343968957662582
okay for the debt that you're holding don't say I just  can't do that they come and give me your daughter  ,0.3092705272138119
these are not sure but remember you're my friend  who's man you are my friend when you came today,6.964796036481857
I don't have money if you don't have  money is anything wrong with that baby,0.5948096048086882
peace,7.383939623832703
you lied to me oh this yes you  told me she's your little niece,0.20704467315226793
how could you,0.15065761981531978
is that why you saved someone listen yeah   was that why you kept calling me  your love awesome I'm not going to,1.6719073057174683
look like this all the investment from my  Society I still got feedback  ,7.756301760673523
so I don't know where it would be  to reclaim you start living with you,3.2955199480056763
anybody to pay back that  investment hello Madison I'm sorry,7.123306393623352
Mario I had all you said,5.101686343550682
and I'm here to know how much and how do  we pay you because I'm here to pay you back,0.4925558343529701
yes,6.636323779821396
what,6.129459664225578
when we are going through  your Mission your poverty,0.04712260561063886
so how did the money come  now yes I was a wretched boy  ,0.7981220260262489
but things are state well no need to go into all  those things like I said I want to know how much  ,8.174945414066315
her father is owing you how much is the debts and  you said you have invested in her I want you to  ,1.9098639488220215
summarize it and tell me the amount of money  you need so I can clear it here and right now,7.945224642753601
there's no uh the point going through the this  dignity because the money is too heavy but even  ,8.36460366845131
if you tell me to quantify it I can talk about in  three years why should I bother you with something,6.640432775020599
with all due respect I do not want to install,5.589033663272858
since you don't have anything to say  about your mom so excuse me I'll be back,0.11510214535519481
this doesn't sound funny to me somebody of new  value yesterday no quantity nothing it's now  ,7.67638087272644
coming to talk about clearing that on such  gargant one vehicles it's funny to me yeah,3.39365154504776
you can see that their love is unbeatable,6.261081248521805
this investment from me that make foreign,5.574866011738777
exactly the they don't even tell you  they checked the check and it's weird,6.074913218617439
I believe so my father was one of the  richest men in Lagos your father Yes this  ,7.76340439915657
was about 25 years ago then I was still little  although I lost my father and after his death  ,2.8009381145238876
his elder brother my uncle took  everything from us hey foreign,1.812327653169632
houses that was like my mother and I wretched oh,0.41418978944420815
suffered an absolutely but you see God is  good and there is nothing God cannot do yeah  ,1.910567469894886
God has answered our prayers my uncle has  returned everything he stole from my father,2.41190567612648
so this man standing before you here is  a CEO of divine bottle water you look it,0.417094212025404
not just not just that I also  have about five companies yes,8.611007034778595
to plan it all I have like um foreign,7.420402765274048
so I would advise you to use that as a little  shopping use it for your own good hey uh,0.8539702743291855
in fact that uh silver and gold abandoned but  all depressed in my family should go to you,0.5413795355707407
my heart I've fallen in love with you  it's your against the culture otherwise  ,5.7920631021261215
if you want more girls from my family  my family girls can boast your breasts if they are okay um if they  are not you carry this one okay,0.09916920680552721
um let me now seize this opportunity to also  let you know my impressions it was important,9.077642858028412
I love this beautiful lady,8.46126601099968
like to the full definition of love and peace,5.425036698579788
nobody is all the plans the dreams you had  together I want to now fulfill it and achieve it,5.690938234329224
and I also want to say it here okay I want to take  this relationship to the next level next level,7.914923131465912
until you get home don't start on  the roads to climb on top of mind,0.3140473738312721
oh let them be let them be,0.34252083860337734
to be together forever,4.373111575841904
to build this would be,7.2622500360012054
Shorts,0.3856789320707321
