Text,Toxicity
thank you,8.900988101959229
hey there,7.190707325935364
love is a very strong thing,7.6906003057956696
my sweetheart,1.6980251297354698
did I love you so much,5.644902586936951
you know what it's okay,7.775324583053589
it's right now what is it why are you guys I love you even more  than myself I love you more than you thank you,8.25556069612503
my love for English my love for you is pure  it is very clear I love you so much even if  ,3.589095175266266
we are the marketplace we are the judge I will  continue to preach the Lord it's so special,6.396108865737915
we have used to kiss each other,0.5587361752986908
coming to still kissing from my  daughter eh or twin people of these days  ,0.3107652999460697
we say you you will come home kissing in public you're not leaving  anything for the man who will marry you,0.5446249153465033
others now good afternoon sir what  is good about the afternoon tell me,8.611714094877243
your mouth is open like a suit what is  good about the afternoon tell me you know  ,0.05197843420319259
I was just passing as I saw you the way  you understand I don't want you to watch I  ,0.9433761239051819
understand since you came here if you're not the  talking correctly you have you been talking like  ,4.89138700067997
a man who wants to get mad do you want to get mad  and I decided to stop and talk to you because you  ,0.08226435747928917
are my father's best friend and I don't want you  to be hot because your daughter and her friend  ,0.16931705176830292
their lovers and that knows them so you  trying to do all this you want yourself  ,0.2764190314337611
okay so you pitched them together they become  lovers closer those who are not husband and  ,3.4483134746551514
married and and wife you are pitching  them together because you are one of the   causes of the problem I'm having in my family  knows when the evidence is there eh hey sorry,0.3386174561455846
people are funny these days this man  should have gone to his business yeah,2.909938618540764
if I look at her critically I can see  and when inside her muffin and coming  ,2.620358392596245
out to to intervene in the Affairs not his  own eh do you know you look like everyone  ,0.6297574378550053
on the other hand he looks like monkey even  the header you come that's where monkeys kiss  ,0.06560382898896933
their heads are you from the ancestry of  monkey now I'm asking you you can ask me,0.0984645914286375
I'm talking to you I'm truly not feeling fine no what do you  think I'll lie about something like that  ,6.803269684314728
I don't lie about my health now I'm  very very sick how will I believe you  ,0.28624641709029675
when they give you heartstroke immediately  become sick I'm telling you this because,0.12248462298884988
one day you will get married and you'll be you  now know that I'm doing you good I'm giving  ,0.9123681113123894
you time for you to change and become a  better person come back to your senses,0.42896741069853306
why are you always like this why are you touching me mama you're not saying  anything no she like going out to do other  ,0.4048120230436325
people's house choice but she does not like doing  house choice in the house say mama for how long,6.445169448852539
mama I said I see me like this I will join sister  team since is this how this one want to diabet  ,0.1898192334920168
okay let's say I go say when there are washing  plate and doing the answers we are fools mama   is not fair ah no it's not fair both of you  should calm down I know what I'm doing please,0.249666185118258
music don't worry don't worry I know  what to do you think you think  ,3.7726707756519318
you can talk to me right you're  always think you can talk to me,7.111667096614838
I don't understand it you you'll be in the  house either sister like you want us to be   washing plate you will form sickness and go  out and then come on so it's me your target,0.2329471753910184
everybody yeah,7.234464585781097
listening to what I'm saying did anybody beat you mean,4.626670479774475
what did you do to him and why you  know about most killed me again today  ,0.4446333274245262
almost killed you but he didn't  kill him at the end of the day right  ,0.5018725525587797
stop being funny she said almost we are saying  the same thing almost you said almost she said  ,1.2604217045009136
almost I said almost you say almost almost now  come let me ask you beauty are you not tired of  ,0.6420169491320848
your father every day one trouble are you not  tired look if you are not tired me I'm tired,0.10645226575434208
as long as he lives I can never be  happy I don't know why papa is doing   all this to me I don't know I don't  understand what does he mean by that  ,1.7909599468111992
huh you need to talk to this your husband the  way he's taking this thing is not good at all  ,0.11892695911228657
ah thank God my husband is your father  so you two talk to your father are you  ,1.1657866649329662
hearing me but but let me ask you why don't  you want to listen to your father oh don't,0.20535413641482592
look at that doesn't even confused I never  confused I don't understand Papa one thing I  ,6.720829755067825
will tell you Over My Dead Body will I marry  any other man if I don't marry my obim if I  ,0.3675550688058138
don't marry a kid I will not buy any other  man no mama I'm saying my own you to try and  ,0.11455588974058628
listen to your father's warning what did you  even see in that time listen to your father   a flight that refused to hit to advice always  end up in the grave ah what's your problem but,0.08145874598994851
why is your father not worried about her  wedding how well that is even your elder sister  ,0.4218232352286577
or is he enjoying your single Hood  every time it's beauty beauty beauty   beauty is he okay or is there anything  he's getting from your single root,3.3597342669963837
I don't understand,3.966670110821724
because I'm not a lover girl like some people yeah   you're not even ashamed of yourself  look at what you're saying at your age,0.11598920682445168
until you know that it's like the morning he  talks about them punish them disgrace them  ,0.2719445852562785
the more their love grows stronger so I will  leave them alone you talk to your father you  ,1.3162926770746708
have to talk to your father even should leave me  alone the father will say talk to your children   you will say talk to your husband everybody  talk to your father ah what is your problem  ,0.14441050589084625
I wish I can just turn myself to a young  girl and go back to my father's house this   trouble is too much hey you want to talk to  a young girl yes my father will still marry  ,0.7795273791998625
you I'll just go about this brother used to  carry somebody's breasts up like this again,0.10349132353439927
and I'll dye my hair again,0.20632524974644184
you see what I saw today see all those  things you need to show in Nollywood movies,6.012873724102974
come down first now come now hear what I want to  tell you guys eh oh really where is your father,0.19101585494354367
you know I like your father  very much like drama hmm,3.135690465569496
say something open up and say it and stop  beating about the bush stop wasting our time  ,0.1375438878312707
it's okay what I wanted to say is very very simple  ahem Ella today I was just working on my own when  ,9.903491288423538
I saw him they were teaching each other and touch  it and then he got to the point I busted them  ,0.3068114398047328
he insulted and insulted he was just  calling them all sorts of blue wow,0.19591967575252056
more than I wish over and over,6.9994620978832245
here is your father acting like he's always,0.06779933464713395
that's why I'm here to advise  you please talk to him before he   will enjoy himself or even kill  someone in this Village please,0.6821273360401392
hey,4.306505620479584
what have I done to deserve what you're doing  to me eh each time I put corrective measure  ,0.7013518828898668
you you leveled me a bad man be a bad man  but whatever I do for you yeah I'm asking you,0.27534598484635353
please please this girl she's been  kneeling Under the Sun for over 30 minutes  ,8.12637060880661
please that is worrying you or for her to  come out of that kind of behavior or for  ,2.10953988134861
her to come out from this illicit Association  this never do well she is associating with  ,0.1615531393326819
isn't that bothering you I'm asking you no I  didn't say anything wrong I'm only asking you  ,5.433164909482002
to forgive her that's all if you played your place  for a good cause I'm not for plead for this hour  ,5.712395161390305
darling daughter to continue with that boy okay  what have you seen in that voice what does he have,4.551961272954941
that kind of a person can be smoking ebook   and affect our daughter with smoking Igbo so maybe  some days if our girl returns from somewhere we  ,0.34827361814677715
perceived smell of people will that be the end  result is it not showing our effort in vain huh,0.10468849213793874
but I didn't do anything wrong Papa,4.376973211765289
you're calling me a fool that he didn't do  anything we observe you've been doing something  ,0.08374801254831254
wrong as our daughter and we are trying to get you  out of it that Quagmire you're saying is indulated  ,0.2607295289635658
that that means the way  where we are foolish people you're compounding the assessment that you're  not your child well you are doing what a child  ,0.032945265411399305
should not do eh okay all your mess are married  if they are married you want to rush marriage  ,0.1592359389178455
and meet Waterloo and meet somebody who who can  bring up a case that police will come and arrest  ,2.0234789699316025
him arrest you you see you see how your argument  is going we wrap stuff for any intelligence eh,0.4068638663738966
you see you what what what do you  want me to do I have lamented enough  ,0.30170916579663754
I've been pained enough because of the  attitude can you come out from this point,7.0962972939014435
the way you act towards me even though he's  asking you don't want me to get married in  ,1.5212109312415123
this life but why doesn't you hate me so much  Papa and I don't even know why but why do you  ,0.22622402757406235
face me it is the case because I love you I don't  hurt you in the course of loving you I want you to  ,0.7329522632062435
also go to a man who truly loves you who is not a  criminal because a criminal cannot love somebody  ,0.22962067741900682
from the heart a criminal the scariest way along  when he wants to commit a crime he carries your  ,0.3358342684805393
life so whenever he is caught you will be involved  that's my fight to bring you out of this boy bring  ,0.30749181751161814
her from the bus so you can have rest of mine  that is just that what are you doing there,3.6195244640111923
they love each other just I love them look at the  word you're using you why well know that that boy  ,8.024072647094727
is not a good person this is if you look at him  on the surface he's a criminal you're now saying  ,0.08723049541004002
leave the two of them okay this one is striking  fear in me that if you get married you get married  ,0.5028973333537579
why do you all love things that are criminal  people who smoke people people who sleep outside,0.08798655471764505
is that the argument you're making I'm suspecting  all of you me to leave them to go on come on,0.3033016575500369
that's what it means,6.639433652162552
yeah have you been a long time so something  like two days now I've not seen you yeah,2.8064219281077385
so um fantastically okay yeah yeah,7.508471608161926
you can see the kind of  relationship you have again   kind of relationship are  wanting my life I really wish,3.405531495809555
from your lips to God yes amen,1.4038192108273506
start going go now I'll see you later peace that last time I was  telling her so I've not finished the discussion,6.280258297920227
I love you so much I love you  too baby why are you not dressed,6.6255249083042145
all right have you forgotten  what you are doing today,4.561635851860046
is Saturday now have you forgotten I told you  that we'll be going to my my mother sister's  ,0.9200611151754856
house to help her with her choice good is it today  what is it today is Saturday now I thought you  ,7.899639755487442
haven't already how did I forget I'm sorry you  know there's a lot going through my mind right  ,6.917666643857956
now I forgot to sorry I know I know there is a lot  going through your head I'm also going through a   lot too but I don't understand are you trying to  disappoint me you mean you're not going with me,0.5115744192153215
forgive me but I'm not sure I can go with you  to go and help your mother sister again today  ,0.16176654025912285
because of what happened yesterday what kind of  thing is this now and I've told that already that  ,8.526858687400818
I'm bringing my gear so now how will I go there  now we'll just be lonely I told her to just you  ,4.319024831056595
know I promise you next time I'll please please  just try now your father will not see yourself,0.25622115936130285
what we are going to go into problem  with this love right now moving please  ,5.405449494719505
please for me next time I promise I wanna  disappointed all right I love you I love you,8.877832442522049
I just can't believe in so much anger is very upset,0.4248910117894411
what happened to go and see his mother's sister again you  ,1.8232641741633415
know we know what is going to be  performance so it's not happening,8.258562535047531
sister one day when will this woman eat it come  tell me when let me tell you something if Papa,0.3204141277819872
I will go to the monastery oh I'm not even joking  I will be innocent sister because Ken is the only  ,1.3574802316725254
man for me sister he's the only one I love that  will not happen no no no you will marry King,0.5969555117189884
are you sure see one day can make so much  money and papa will have no choice,5.4183319211006165
this is,3.1821586191654205
okay choice,7.870859652757645
it just want somebody that can  take care of things that proper  ,8.099166303873062
action it tells differently because  I'm not sure it's about money alone   the everybody is to act it's as if I  don't know if I want me to get married  ,6.203208491206169
you don't even understand the king I'm not  sure you just knowing it's true but then I know  ,6.008409336209297
when Ken makes money you know less money so much Don't Worry Be Happy enough,0.7362686097621918
okay,6.343968957662582
I need to do something and it has to be now,3.0723122879862785
foreign but the question is what will I do should I run  away I I mean should can and I run from this place  ,1.0378201492130756
no no that is not the best thing to do  ,6.422290951013565
but we can go to the city and hustle  like others so we can make money  ,4.383481293916702
I think that would be Papa accepting now,8.561105281114578
but where will he go   he knows no one in the city besides his  Wicked Uncle who has refused to help him,0.1296820817515254
thank you,8.900988101959229
Beauty no I'm still on the way where are you going,4.802647233009338
and I just wanted to maybe,8.592494577169418
go to wee-wee with a bug with that  bag right there you want to go and we  ,0.05899698007851839
will with your bag or maybe you want to  pour the wheel inside your bag isn't it so you have this fear for your father and you  had the mind to to to to run out of the home  ,0.08768372936174273
have you got into this eh Roti it has gotten the  days you want to run out of your family's house  ,0.1038441201671958
I want to run away want to leave  your parents house and run away,0.26867929846048355
if you are still that tired I get better some  years ago because since that boy came into  ,1.455559954047203
your life you've been behaving like someone  that has psycho are you sure you're okay is  ,0.054798676865175366
oh you're okay and you want to run away,0.32827507238835096
want to follow a man and run away,0.2430011983960867
you can go no no you can go it after my  suffering after all the effort I've been  ,1.6999300569295883
making to raise you and your sister to be good  children I don't have a boy and people have been   mocking me because of it and I took a decision  that I will make you be that man I never had  ,0.1751761301420629
to be that son I never had  no problem you can go Beauty,0.13071884168311954
please,8.127769827842712
he's really my daughter honestly  I don't know how to thank you,5.381538346409798
the way you've been coming  around to help me in this house,6.944216042757034
you don't need to thank me  now you don't need to thank me   am I not supposed to be doing all these things for  you what have I ever done I've not done anything,3.53376641869545
yeah in this life I was born to help you God bless you bless you too honestly I wish I  ,6.148810312151909
have a daughter like you to be  helping me just the same way,0.16912419814616442
people don't have to say that  I might know your daughter,5.012589693069458
I don't understand I totally understand  that is why I'm always here for you and I  ,7.093117386102676
promise that I will always be here  for you anytime you need me okay,3.4918487071990967
I love you too much,6.299133598804474
I saw him move but that was yesterday my mom  if you see the way he was running as his son  ,3.001192584633827
was after his life why who was torturing you who  else if not Beauty's father I said it yesterday  ,0.23003106471151114
I said it but he lied to me because he probably  think that I'll be angry if he tells me the truth,2.2153720259666443
he doesn't want to listen to me  ,0.3018204355612397
want anything bad to happen to him everybody in  this Village you know that is a very mean man,0.7613148540258408
don't worry nothing bad will  happen to your son all right   hey man it's going to be okay in  fact very soon this will be over,0.6972320377826691
here yes I'll take you any flavor you can just  ask for any favor and I'll do it thank you,8.807525038719177
yes how are you I'm fine thank you long time miss  you how are you I'm fine though I'm just fine this  ,4.263923689723015
one you so you're here today I hope there's no  problem no there's no problem so how is beauty oh  ,2.3384787142276764
my love she's she's fine she's very fine my love  is fine okay how are you I'm fine okay um there's  ,5.282797291874886
something I want to tell you if you count that  thing with please you can see the sun is too much  ,5.715194344520569
maybe we can talk later let me just talk to you  now now the other day I went to the house we're  ,9.468979388475418
not there and you know it's hard to get rid of  you let me just tell you what I want to tell you   now it's very important to me it's very important  yes okay just tell me now tell me people be fast  ,1.4974257908761501
you remember that day that you and Beauty were  standing on the road kissing and shoe you know  ,0.6203669589012861
the day the father was pursuing you as if someone  is terrible you remember that number what happened  ,0.8975273929536343
after that moment heading telling someone that  he's going to send some bad boys to come and beat  ,0.4679689649492502
you mercilessly he even told them that if they  can't they should kill you that is none of his   business ah is that why you stopped me yes sir  that one is no longer news now everybody knows  ,0.4059157334268093
that now that um Mazi okolo doesn't like me eh  I don't know what I have done to that man is  ,0.32128910534083843
he a crime to love you see I love beauty with  so much passion beauty is my life I cannot do  ,0.8795923553407192
without her any day I wake up beauty is in  my head if I sleep beauty is in my heart I  ,1.8065109848976135
mean the love is just too much it's love a  crime what wrong have I done to Mercy that  ,2.612549811601639
is he's just carrying my name cassetting my name  up and down what's wrong have I done to him okay  ,2.2175999358296394
this one is not about if you have done him any  wrong or not your life is at stake here and there  ,0.5968438927084208
is nothing that is worth your life eh come on  this beauty that you're trying to kill yourself  ,0.28865921776741743
on top if anything happens to you now she will  move on and okay let me tell you she will move  ,0.8419880643486977
on with a man that is even better than you think  I'm joking girls especially that beauty hey see  ,1.2604809366166592
try and stay alive for yourself well there is  nothing worth your life if not for anything for   at least your mother you know how much I love that  woman if anything happens to her I won't be happy  ,0.5011079832911491
I'm sorry if you think I'm intruding into your  personal life oh no no no no no it's okay if you  ,4.393149167299271
see you're like a sister to me so it's it's a good  thing you came to tell me this at least now I will  ,1.5571911819279194
be more careful and also thank you for your advice  thank you for everything no problem I mean say  ,9.161953628063202
well to your family for me yeah oh yeah let me see  let me start going in case this one is tomorrow  ,0.7902046665549278
come now at least give me a hug now see the kind  of information I brought to you you know all right,7.015953958034515
is that you almost hurt me serious if  you please let me go all right take care,0.3727286122739315
hey how can one person with this fight,0.8493570610880852
the love of my life which,4.048227891325951
did I hear this boy call me  sister this guy the player,0.6053687073290348
foreign,6.298292428255081
you used to be but not anymore since that little  boy came into your life you you suddenly became  ,0.06758582894690335
mad what is your problem now so after all  the mockery I've received in this Village  ,0.039249236579053104
everybody they describe me if they want to know  which chairman they will say that chioma that  ,6.508733332157135
did not give birth to a son not before so after  all that mockery and I made up my mind that I'm  ,0.3571900771930814
going to raise you and your sister to be that son  take all better or even better than those their  ,0.1615696121007204
son what everything their sons are accomplishing  that I will make sure both of you accomplish it  ,5.098177492618561
wants them to laugh at me do your back that you want to run  run now what are you waiting for eign,0.29803356155753136
ah,3.7084363400936127
mama you don't look happy now nothing is wrong Mama we're just disgusting,0.022123985399957746
they are just discussing with your body please I don't want to answer me nothing so mama  what is abuse with this back now you just cannot  ,0.12754537165164948
see about you drink your mouth nothing's wrong  with that this is wrong with that where is Papa,0.04795855202246457
before I know you want to just just collect whatever  Mama nothing is happening somebody is running  ,0.3969630226492882
away nothing is happening here Beauty okay  I'm not trying to run away take your types,0.6034024525433779
who's trying to run away now who just run away now,0.48288325779139996
foreign,6.298292428255081
oh my God is a very strong thing my love I've been  waiting for you special thing what you  ,7.7905334532260895
know I'm not good at guessing  do you know I was missing you   so much oh you're missing me I'm  here now and I've missed you too,0.9874183684587479
I've been you know I I picked a few of my  things to do and I wanted to help with you  ,9.419257193803787
but thank God it was my mother that caught me  I know my father oh you wanted to do what why,4.445096850395203
I'm tired see the way my father is treating us  today my father killed embarrassing oh he doesn't  ,0.35496570635586977
want us to be together but but my love we want  to be together right you want to be with me and  ,1.8215367570519447
I also want to be with you don't worry about our  parents all right what matters more is our love  ,3.4941069781780243
our genuine happiness I know with time  all these things will stop and we'll be   together forever okay don't try to do that  next time please be careful for me hello,9.117162972688675
I've told you can't last time that I don't care  about what people will say listen I will marry I  ,0.5929649341851473
must marry you I must end my life issue I can't  yeah I've not even seen any woman again the only  ,0.26197696570307016
person I have right now is you I only think  about you I don't have a friend you know do   you see mood friends is this because I love you  I want to believe what what do you mean by that  ,7.798111438751221
if he's like a sister to me so many Temptations that's why you are doing like this who's this  person you are trying to do like this for you  ,1.4632746577262878
are giving giving the person green light too I  don't know but I think I'm in love yeah I love  ,8.534090965986252
I hope it's locking whatever okay so tell  me who's this person who's this person ah  ,3.9533328264951706
God I'm so much in love with him like he has  taken over my thoughts he has taken over my  ,1.9578425213694572
I mean my medulla oblongata like I cannot stay a  minute without thinking about him like oh my God  ,1.565144769847393
this mother is making your bodies with  you like this is it from this Village  ,0.06529520615004003
and I think you know him I know him what is his  name um when the time is right you will know him  ,8.687855303287506
but for now okay I know you're not safe see this  one you already brushes you need to watch yourself,0.4841758403927088
because,4.622302204370499
the way I feel right now,8.845871686935425
what are you looking sad see I told him we went to the market so in case he had  to tell him the same thing why do I avoid trouble,5.819695442914963
I am tired every day everything what problems  that I am just sick and tired God please,1.1208715848624706
