Text,Toxicity
please for my father you know  what that's not even my problem do you see be careful,3.469240665435791
I wanna,0.5740827415138483
I was inside doing what I was  arranging the clothes in the room  ,6.034724786877632
okay okay um where's your sister  I told you she went to the market,0.2029835944995284
okay you can go you can go um I was I  was wondering if I met her on the way  ,7.956183701753616
yes papa I think you missed her on  the way she just is not quite hey,6.675137579441071
Papa did you did you check how much is this job  that's what I didn't do I'll I'll check because I  ,4.049495607614517
I don't want anything to  happen to this my daughter  ,0.4814564250409603
I'll check okay it seems It's hard  written that's how okay just go and rest,4.065445438027382
I'm back where are you looking very weak working  weekly is there any problem feeling true what is  ,0.19740446005016565
your sickness huh what do you tell me because I'm  I'll be ready to go and buy a medicine for you  ,0.18782018451020122
oh what what do we call it headache or temperature  or what you know sorry what do we call it,3.6737076938152313
I did not say my body was paining me I just said  I'm not feeling sure the man should care for his  ,2.353420667350292
daughter if I don't care for you who will care  huh sorry oh sorry ah the temperature is this  ,0.0885490677319467
your body is very hot why should we wonder why  did you allow it to grow grow like this please  ,0.10709443595260382
stop touching me did I say my this is paining  me okay they're touching things do you have  ,0.3794850781559944
some other person to care for you the enemy  who can do it very well do it very thoroughly  ,0.4052218981087208
huh you know if I have my way if I have knowledge  I will just give you injection like a doctor,1.0738692246377468
all right the recipe very well the the sun is a becoming  something else oh don't allow this on a factory  ,4.081181436777115
at all don't want any of my children to go through  stress to go to bad weather uh I want you all of  ,0.9208858944475651
you looking good okay look at me how good I'm  looking it's because I don't get myself on  ,4.994524270296097
duly exposed to this kind of song you know where  this kind of village where do you get medicine  ,4.289507120847702
they will go and get a dogon yellow  for you to drink let's have a problem,0.1590824220329523
Jackson huh now I can see the insults so if  he refused to accept me as a man time,0.8187026716768742
she told me that she's in love with care  again who is not even in love with her,0.44672037474811077
what's her life come to think of it what does care that  our eye Jacks don't have come on now,0.6541393231600523
Ken is cute yes but I'm cute also  ,7.053213566541672
yes I'm cute I can't have pink  leaves hmm but I have pink Clips too,2.353164181113243
can you speak Mass my body,0.45127025805413723
I will not give up I will never give up  yes I know what to do I know what to do,4.348954930901527
to your house it was forgive me,3.569713607430458
even before you ask I've forgiven you after I did  not kill anyone thank you I don't understand why  ,0.9342296980321407
are you looking all stressed up why not what  is wrong my friend you will not understand  ,3.4591156989336014
tell me make me understand at least I cannot  divorce you to the best of my knowledge the man I  ,0.2156170317903161
am in love with I actually want to spend the rest  of my life with you my father has one that Oba is   dead body I really are not being married this one  and Beauty let me tell you your father is right  ,0.37733111530542374
your father loves you so you want a bright future  for you please you will not understand my credit  ,1.3852547854185104
my father loves me so much he he keeps telling  me I am a store party I don't even understand  ,3.1658727675676346
even though that what but it keeps eating it  all the time and you know because Ken doesn't  ,4.825209453701973
have money now kid is actually not buoyant  my father keeps saying instead of me to   suffer in the name of marriage and better remain  single with him I don't understand the problem,0.4080371465533972
my friend his father loves you he loves you  and every father wants to see their daughter  ,2.567945420742035
do well yeah your father loves you so much and he  wants the best for you so what you will do now eh  ,1.8636222928762436
the love of your life don't  tell him to go and make money   thank you when he makes enough money he  will becomes your father's Choice oh my God,0.3563717007637024
thank you so much my friends,8.848637342453003
thank you,8.900988101959229
nice nine what are you doing all this now  why are you doing all this how can you go  ,2.188270539045334
around the whole village telling everyone that  cares to hear that they should one can that they  ,6.048839166760445
should stay away from her daughter what is  the meaning of that now I am safeguarding my   own uh if I calculate how much I spent of the  investing in our daughter I won't I won't play  ,1.3209735043346882
with anybody who who is who is a layer about  who is not serious in in life to come here to  ,3.121698275208473
reap where he did not so I don't know my family is  but not for Ken yeah not for Ken so what it can do  ,3.7578724324703217
to you what they did to me what did he do to me  it's not it does not work hard they must go and  ,4.5999545603990555
reap where he sold not from from my family what  did he do in this family that I invested so much  ,3.5649601370096207
in my daughter and he is now coming to reap  I don't see him meriting it no I won't allow  ,1.1969657614827156
that if two of you have a partnered to achieve  that I'm telling you it won't work nine nine  ,7.591304928064346
you realize that this same can is the only child  and the only son to a widow he lies a poor Widow  ,0.20577777177095413
and she can't afford to lose her son because  because he's loving your daughter sentimental  ,0.4593127407133579
I was listening to you to tell me the achievement  of Ken he was saying we do what what do we do with  ,8.898252993822098
Widow and so on that one is uh ephemeral I always  say you make it costs no eyes it does not concern  ,2.0188061520457268
me I have worked hard in my life and I have met  my daughter to go through hard work but to go and  ,7.33753964304924
direct scan where to read not in my family not  in my compound that's the point I've been making  ,8.222054690122604
oh wait wait wait wait wait wait till nine is it  this this little conversation we are having that,3.896098956465721
that's just I'm sure I'm making a point  I'm making a point I'm sure I'm making   a point no no not nine just listen to me I  want you to allow our daughter to be happy  ,6.470736116170883
love beauty to be happy Ken loves her daughter  they are in love so let them be actual when I  ,5.395529419183731
go married to you what did you have what did you  have you heard nothing or have you forgotten so   soon those who love our daughter are meaning what  I want is any man who will come my daughter's way  ,0.4622544627636671
should be a man established to be hard worker  working hard so I've not recorded Ken as a  ,7.710175961256027
a person who works hard so he's coming  that this man has a a polished a woman  ,2.235483005642891
that he will just come and jump into I won't  allow that people must weep where they sold  ,0.36187360528856516
Ken should go and reap where he has sued if he  has not sowed yet let him go and start afresh,0.42938836850225925
I understand how difficult it is  to you I know you can't I know it's   difficult but try for once in your  life allow Beauty to be happy please,3.0761443078517914
misleading her daughter I can't be party  to misleading our daughter our daughter  ,0.47400197945535183
has threw my training enjoyed hard work so  let him reap through hard work not to come  ,5.416733026504517
from nowhere to to balance on our dining table  dining chair and we're eating chocolate no attack,4.692041128873825
it's not possible okay you don't want to listen  to what I'm saying no I'm listening to you but I  ,1.8390826880931854
must not do what you are saying yeah and  if you don't want to do what I am saying  ,4.367351904511452
if you don't want to do the one I'm  saying in the daytime in the night   I will not do what you say can't die  Force you um look at what you wanted,0.5715155974030495
marry him back,0.3559668315574527
this one is challenging me I have seen goodness  so don't come here I paid all your dowries so  ,0.14534848742187023
don't come and deny me anything each one I I  I I I ask you you give me at my back and call,0.41136424988508224
I jump,0.31407338101416826
away,1.2416446581482887
no foreign what is the matter why are you crying  ,0.3517555771395564
that means so much pain is  the reason I'm in despair,1.5164782293140888
it's okay it's all right my dear stop crying okay  look I'm I'm sure he said all that out of anger  ,0.3392883576452732
they can I know loves you so much I shouldn't  have spoken to him the way I did oh no don't say  ,6.0204967856407166
that look I love the way you spoke that's  division okay so please stop crying mama  ,1.2321630492806435
are you sure God will leave me oh no not at  all they can I know will never leave you he  ,0.42153489775955677
loves you so much so don't worry I'm sure he  will come around everybody hopes he will I  ,4.6944450587034225
hope so because Ken is my life mama I love him  so much he can't leave me I don't know if I'll  ,2.9066355898976326
survive but I don't know please tell me what  do I do now okay listen to what you have to do,4.047330468893051
number one is that Ken loves you so much  forget that he doesn't have money now the  ,1.917668804526329
fact that he doesn't have money now does  not mean that you remain like that forever   look I've seen I've seen close that had so much  money so much when I mean so much so much money  ,3.103115037083626
there was no love in their marriage and because  there was no love in their relationship there was  ,5.196163430809975
no Joy of that before you say Jack that marriage  became problem rumbled and ended in bad news  ,3.636400029063225
telling you really feel one thing love is the  most important thing in every relationship love  ,6.665455549955368
see what's love him every other thing we made easy then  money cannot be taken away from any relationship  ,5.769621208310127
especially in marriage because when a man says he  loves you he needs money to grease that love yes  ,1.3778221793472767
he needs money to take care of you he needs money  to make you happy he needs money to make your face  ,0.09422710281796753
shining if money to make you beautiful all right  thank you thank you so much you give me serious  ,8.410589396953583
word of knowledge today for the first time in  my life I will never forget it thank you Mama  ,5.253386124968529
you're the best mother in the whole ah you're  always welcome my daughter that is daughter,1.4686500653624535
I don't want you to be staying alone yes,2.100696600973606
yes I have a gist something that  happened in the market yesterday,7.816716283559799
um so guess what,6.4090631902217865
so he kissed me and hugged me good I'm the  happiest girl alive so because in my peace  ,3.470657765865326
that's why you are the happiest girl alive yes so  see I don't expect you to understand okay okay I  ,1.2739808298647404
won't understand but tell me who is this man who's  this man that you don't want me to know about it  ,3.7406805902719498
have I not told you I told you to just wait  time is right outside okay don't tell me,4.3229419738054276
please you're not jealous,1.3777796179056168
are you sure of what you just said to me   yes I saw the both of them but they might  not have something yet of course I know  ,9.522321820259094
because I trust Ken with my life my love is  perfect he will never do such but you see  ,6.502474099397659
I don't trust that if you have a girl one bit I  don't even me that game might be up to something,0.6024245172739029
I will you mean you saw iffy washing  dishes for my future mother-in-law to be,1.094916183501482
I swear I will kill that girl before she even  touches my mind trust me just lay that idiot go  ,0.46293563209474087
concentrate on your mind don't even say that  to me don't say that to me I know what to do,0.4667744506150484
ha,0.8783037774264812
all right hello,7.136686146259308
hello yeah Miss a man listen,5.117693915963173
I don't like trouble but I made trouble last 30  years but I retired because there was no need in  ,5.188622325658798
trouble but you're making me revive my spirit of  trouble whenever I do something will happen to  ,0.6392787676304579
us say I'm ready to gosh your two eyes out better  check Matthew so be careful don't let me call you  ,0.40027606301009655
again because of this death do you hear me do  what you're supposed to do thank you very much,0.6070001050829887
just wake up because it will only  remain a dream and never a reality,1.0632533580064774
and not a reality said Beauty I don't want to make trouble with you  ,1.535400003194809
and you know I I really liked you two  together because I know what you guys  ,8.94070565700531
have is true love I know you love him and he  loves you thank God I knew that I knew that  ,8.43898355960846
so please you guys have love for each other I have  love for myself sometimes you're very very stupid  ,0.03806486201938242
you're very stupid you're very silly but let me  warn you no let me advance you rather stay away  ,0.026967082521878183
okay stay away from the opening stop forcing your  sin yourself are you not ashamed of yourself no  ,0.04323492175899446
don't always train yourself at the man that does  not even want you stay away stay away from my man  ,0.2105236053466797
okay my anger is you're always talking about my  mind my own being my love my boyfriend what is  ,0.17076225485652685
wrong with yourself no no tell me what do you know  about love eh do you want that poor window eh to  ,0.08061331463977695
lose her only son because of your stupid feelings  what is your business mind your business mind it  ,0.02901780535466969
um just listen good by the time I'm done with  care eh I'm becoming history in fact he will  ,6.019141152501106
start seeing you like a fellow man God will  punish you you're very stupid God will punish  ,0.12103038607165217
you for this rubbish you just said but I'm  warning you away from my man in fact you the  ,0.04122865793760866
man telling me Beauty punish you you're very  stupid stealing from my man the next time I'll  ,0.07842527702450752
even stand like this with you you will not let  whatever you stay away I'm warning you stay away,0.37483740597963333
you know I'm actually having fun  because she's really seriously  ,4.047302156686783
no she's short ladies stay away  from my brother stay away from him  ,0.20940955728292465
you lost can the moment you and your father  called him Paul you just gave me access road  ,0.37071811966598034
to him that you just made it easy for me to have  him the moment you called him Paul do you know   what you did to his self-esteem I came to him and  I walked to him I gave him confidence and now I I  ,7.395198941230774
I I then showed him how to you know how to to love  another woman you have lost him for good all right,0.5678852554410696
thank you,8.900988101959229
so what's happening to your sister anymore,0.1725293812341988
please I don't talk about that,9.102704375982285
um I even had those two love but they  they fought for the first time in history   what does if you're going to do in all of this  ,7.523342967033386
um You didn't tell that if he was responsible  that girl so they have still two misunderstandings,6.079506501555443
oh no wonder she was just blushing  she told me she's in love not even  ,3.902045264840126
ask her why do you love me she said  she will not tell me until the time   is right I will not tell you  I'll tell you when I'm ready,4.201755300164223
this is very painful how did she go this far this  is not right I need to talk sense into that girl,5.580470338463783
if you what is wrong with you are you this weekend,0.5898024421185255
peace I am having a bad day I've had  a very stressful day are you hearing  ,4.753917828202248
me so I don't have time for this rubbish  I don't understand you don't have time   for this rubbish let me tell you everybody in  this Village knows that those two are in love  ,0.03840015269815922
Kane can never love you that's what you  think yes that can can never love me  ,0.6401454098522663
watch and see watch and see okay I will  turn the impossible possible in this Village,5.674649775028229
I don't understand see let me tell you if I  should advise you as a friend eh Jackson loves you  ,8.34832414984703
so go to Jackson because I never love  you so you're trying to advise me  ,1.120295189321041
based on what eh you or anyone else not tell  me how to live my life or who to love okay  ,3.2509878277778625
thank you see I pity you because Beauty will kill  you why don't you see that King does not love you  ,0.48344340175390244
or are you going to marry his mother  there is something people don't know  ,0.3848073771223426
Ken's mom will make kids lovely whether he loves  me right now or not okay so mind your business,0.10669009061530232
so you are working out see you you will regret  it to Jackson please I need your help please  ,1.7497917637228966
what is it Jackson please I need  you to help me talk to carrot  ,7.7149853110313416
because I don't want to lose my own thing  see I didn't mean to call him poor it was  ,0.17327545210719109
all a misunderstanding please please can't  misunderstood me I was just trying to you  ,8.799243718385696
know push him to encourage him but but that's  that's by the way please help me come too  ,8.21373239159584
sorry I can't talk to him for now why  why you're his best friends are you guys  ,6.9915711879730225
squarely you guys have issues Jackson please  whatever it is drop it aside you have to talk  ,6.734052300453186
might be in please you're the only one who listens  to so help me Beauty if he wants to talk to Ken  ,2.2179022431373596
you better go to his house and talk to  him yes why are you looking my sister,0.7555180229246616
friends please please me drop right aside and just  help me please it's their own good too all right  ,10.46607419848442
I will talk to him well first I told him I'm in  love with if he said he has nothing to do with her  ,5.935158953070641
that's what he told me he writes  Ken has nothing to do with you  ,2.848641760647297
I'm not even lying that's the truth if he's the  one forcing herself okay and and the saddest  ,0.2820265479385853
part is Ken's mother is in support of all  what is going on because she's she's trying   all her best to separate me for Ken because  of my father's strength please don't let the  ,2.3124728351831436
plan work please help me if you say so why  did I see both of them in their compound why  ,9.180828183889389
Jackson listen to me whatever you show  it's not actually what's going on trust  ,4.66216504573822
me if he's the one forcing herself okay  Ken does not have anything to do with DC  ,3.4332796931266785
see right now that's not even the issue what we  should be thinking of is how to come together  ,8.563743531703949
um I I work like a theme yes you love history  right yes then do everything possible to take  ,8.392845094203949
that girl far away from my man do whatever you  want to do with it take your feet to wherever  ,0.1179293030872941
you want to take it into so I can have my  man all to myself let's not allow please,0.6331734824925661
you are right now I understand you,7.620131969451904
you need to take this one that is yourself  you want to be the best man that she will  ,3.6607757210731506
do everything possible to take care away  from me and that I will do nothing because   Ken's mother is suddenly behind us if  you said that yeah she did that please,0.6069710943847895
I can't lose my mind please please thank you,7.721202075481415
where is your sister once you went out to where,0.11680262396112084
is your sister when she went out   so yeah don't die your sister want to kill me  does she want to kill me hopefully let you not  ,0.42260000482201576
have peace because of beauty and her boyfriend  is she the only one that has a boyfriend huh,0.07401165785267949
calm down everything will be fine soon  everything will be fine soon how do you mean,4.778619110584259
what are you what are you both up to what  are you planning tell me am I nothing you  ,0.5175836849957705
see if you tell me I won't let her know I'm  away just talk to me don't tell me now I  ,1.3417948968708515
want to hear all those girls girls gist  all those girls I want to know this one  ,0.2724139951169491
tell me now now and how big you I bought Big  Dry fish normally dancing give you something,0.43409564532339573
earring for you nothing I cannot kill my sister  okay okay I'll buy fine dress for you just tell me  ,0.32450458966195583
nothing is happening true what  are you planning with your sister,0.22310048807412386
I told you I thought you had a voice shouting,7.3983728885650635
we are here,5.444943159818649
drama where is your daughter beauty bring her  out my daughter my beauty is not at home I hope  ,0.3743893466889858
all is well is there any problem with the three  times what do you mean why you pretend as if you  ,2.3185547441244125
don't know what is happening eh I want your  daughter to stay away from my son want her  ,0.20129939075559378
what did she do can you just open up and tell me  what did she do you are asking me you see why I  ,5.289483070373535
don't like your behavior you are asking me as  if you don't know what is going on I don't know   so she did not tell you how she arranged with  her fellow talks that she calls her friends  ,0.5808086134493351
they let Ambush for my goddaughter if he and  beat her up just because she saw iffy which  ,0.4053582902997732
came together they beat her up what did  they have killed her for me my own Beauty  ,0.47878450714051723
fighting in public no that's not possible I  raised her up well you did not raise her up well  ,1.3441883027553558
but let me tell you something you see that if  he she's my goddaughter she is the only girl  ,0.2246710704639554
in this whole village that comes to my house  to help me with my house choice I don't want  ,4.760086163878441
anything to happen to her one your daughter I  don't want to ever see her near my son I don't  ,0.3357312176376581
want to ever see her near my house if she does  I will deal with her I will deal seriously with  ,0.8732272312045097
her you know me oh I don't have customer when  it comes to trouble people should not try me,1.177079975605011
you know me I'm gonna trouble  I don't have customer I will  ,0.45994333922863007
deal with everybody this Informer come down now,0.4396466538310051
ah mama leave this woman let her go I beg up  your mouth will you shut up your mouth yeah  ,0.1313810353167355
you need to hear what your sister did how can she  be fighting in public because of a man huh look  ,0.12715287739410996
look any woman any girl any lady know how to  fight have fellow woman over a man is Shameless  ,0.06520600290969014
that's the worst thing any woman can do fight it  over a man you better be careful is it not as soon  ,0.14768001856282353
that has been following my sister up and down  and so are you supporting what your sister did   are you supporting what she did Mama are you sure  she's saying the truth don't don't say that again  ,0.3586995182558894
I've known Informer for years I know her she  can't lie over what now why would she be lying  ,5.835044756531715
huh my sister cannot do that your sister  cannot do that we are here we don't know  ,0.11802022345364094
what is happening outside your sister is  fighting and you're here defending her you   tell her I want to see how when she comes back no  daughter of mine will bring shame to me nonsense  ,0.10912757134065032
if I have only girls let me train them  well did you hear what she said she's   even insulting because I don't have a son so  the girls I have I have to train them well I  ,0.41110836900770664
have to make sure they don't bring shame to me  let her only son bring the whole world for her   it is well It is Well grandsons I trust you beauty  I said she kneel down look at you you should be  ,0.3619898809120059
ashamed of yourself going around fighting because  of a man huh useless we don't know that very well  ,0.04449983243830502
Beauty has not eaten since he says that stupid  game that's what's called sister really I swear  ,0.08316923631355166
sweating my friends I thought I was I  leave my man why will you shut up shut up  ,0.03418611304368824
who is your man who is your man  you're not ashamed of yourself you're fighting you you wait I'm gather your  fellow girls to fight somebody because of a man,0.10988559806719422
because I allow you to sit here do you know the  level of Shame your sister has brought this to  ,0.04269925120752305
this family case mother came here and was shouting  screaming insulting every member of our family  ,0.08516908856108785
hey how about your sister be as stupid as going  to fight a fellow girl over a man that has not  ,0.05704163922928274
even paid that right price he believed me Mama I  did not find this girl no fight no friends come on,0.30820155516266823
up beauty is innocent it's innocent if he is  the cost of all the problems we are facing,0.7532664109021425
yes why would she go down I don't know  she taught me a difference and then told  ,6.597650051116943
my mother a difference in as well the  only reason my mother came here to be   you know shouting at you okay was because my  mother is very close to her so she lied sorry,5.308299511671066
